{
  "annotation": "",
  "content_type": [],
  "created": "2026-06-11T10:18:52.897Z",
  "dimensions": "",
  "edit_comment": "",
  "edit_state": "Edited",
  "extent": "94",
  "incipit_statement": "",
  "language": [],
  "musenalm_id": 130711,
  "musenalm_pagination": [
    "2. Arabische Seitenzählung"
  ],
  "musenalm_type": [
    "Text"
  ],
  "numbering": 21,
  "parallel_title": "",
  "place_statement": "",
  "preferred_title": "13. Carl Fischer",
  "pseudonym": false,
  "publication_statement": "",
  "responsibility_statement": "unbezeichnet",
  "scans": [],
  "subtitle_statement": "",
  "title_statement": "13. Carl Fischer",
  "updated": "2010-02-23T00:00:00.000Z",
  "variant_title": "",
  "year": 1836,
  "editor": "",
  "contributors": [],
  "entry": "5lh8wo9m4rix0p5"
}
