{
  "annotation": "",
  "content_type": [],
  "created": "2026-06-11T10:18:04.174Z",
  "dimensions": "",
  "edit_comment": "",
  "edit_state": "Edited",
  "extent": "",
  "incipit_statement": "",
  "language": [],
  "musenalm_id": 51966,
  "musenalm_pagination": [],
  "musenalm_type": [
    "Karte"
  ],
  "numbering": 26,
  "parallel_title": "",
  "place_statement": "",
  "preferred_title": "Der Canton / Glarus",
  "pseudonym": false,
  "publication_statement": "",
  "responsibility_statement": "Gez. von H. Keller Gest. v. J. Scheurmann",
  "scans": [
    "alm_709_51966_6li3yijzwc.jpg"
  ],
  "subtitle_statement": "",
  "title_statement": "Der Canton / Glarus",
  "updated": "2007-10-02T00:00:00.000Z",
  "variant_title": "",
  "year": 1809,
  "editor": "",
  "contributors": [
    {
      "id": "l9y8n0wcvmf6u84",
      "agents": "hp3ztaqa2ipzjih",
      "annotation": "",
      "conjecture": false,
      "created": "2026-06-11T10:18:59.546Z",
      "edit_comment": "",
      "type": "Autor:in",
      "uncertain": false,
      "updated": "2026-06-11T10:18:59.546Z"
    },
    {
      "id": "ofg75j2svbz06nj",
      "agents": "9ql0nfn99kgr5a3",
      "annotation": "",
      "conjecture": false,
      "created": "2026-06-11T10:18:59.547Z",
      "edit_comment": "",
      "type": "Autor:in",
      "uncertain": false,
      "updated": "2026-06-11T10:18:59.547Z"
    }
  ],
  "entry": "2z9wdi3rztqdz5t"
}
