{
  "annotation": "<div>Vortitel</div>",
  "content_type": [],
  "created": "2026-06-15T10:43:43.878Z",
  "dimensions": "",
  "edit_comment": "",
  "edit_state": "Edited",
  "extent": "1",
  "incipit_statement": "",
  "language": [],
  "musenalm_id": 140000,
  "musenalm_pagination": [
    "Arabische Seitenzählung"
  ],
  "musenalm_type": [
    "Titel"
  ],
  "numbering": 1,
  "parallel_title": "",
  "place_statement": "",
  "preferred_title": "ALMANACH / NOUVEAU / DE L’AN PASSÉ, / OU / L’ALMANACH PUCE. / No. 2.",
  "pseudonym": false,
  "publication_statement": "",
  "responsibility_statement": "",
  "scans": [],
  "subtitle_statement": "",
  "title_statement": "ALMANACH / NOUVEAU / DE L’AN PASSÉ, / OU / L’ALMANACH PUCE. / No. 2.",
  "updated": "2026-06-15T11:16:19.005Z",
  "variant_title": "",
  "year": 1786,
  "editor": "hbwf3kmsfyyeo1u",
  "contributors": [],
  "entry": "ez5st062mqvgvpd"
}
