{
  "annotation": "2 Sammlungen mit 8 Rätseln INr 22472-22481, Obj 95-104",
  "content_type": [],
  "created": "2026-06-11T10:17:51.908Z",
  "dimensions": "",
  "edit_comment": "",
  "edit_state": "Edited",
  "extent": "416",
  "incipit_statement": "",
  "language": [],
  "musenalm_id": 22471,
  "musenalm_pagination": [
    "Arabische Seitenzählung"
  ],
  "musenalm_type": [
    "Sammlung"
  ],
  "numbering": 94,
  "parallel_title": "",
  "place_statement": "",
  "preferred_title": "Charaden und Räthsel",
  "pseudonym": false,
  "publication_statement": "",
  "responsibility_statement": "unbezeichnet",
  "scans": [],
  "subtitle_statement": "",
  "title_statement": "Charaden und Räthsel",
  "updated": "2002-02-28T00:00:00.000Z",
  "variant_title": "",
  "year": 1822,
  "editor": "",
  "contributors": [],
  "entry": "6fmihr0nycsi5f1"
}
