{
  "annotation": "Beilagen (Sammlung INr 9080, Obj 38)",
  "content_type": [],
  "created": "2026-06-11T10:17:46.571Z",
  "dimensions": "",
  "edit_comment": "",
  "edit_state": "Edited",
  "extent": "303",
  "incipit_statement": "",
  "language": [],
  "musenalm_id": 9082,
  "musenalm_pagination": [
    "Arabische Seitenzählung"
  ],
  "musenalm_type": [
    "Text",
    "Tabelle"
  ],
  "numbering": 40,
  "parallel_title": "",
  "place_statement": "",
  "preferred_title": "II. / Etat / aller / OberBefehlshaber / der / Armeen und Flotten / der fränkischen Republik, / zur Epoche des Nov. 1795",
  "pseudonym": false,
  "publication_statement": "",
  "responsibility_statement": "unbezeichnet",
  "scans": [],
  "subtitle_statement": "",
  "title_statement": "II. / Etat / aller / OberBefehlshaber / der / Armeen und Flotten / der fränkischen Republik, / zur Epoche des Nov. 1795",
  "updated": "2001-01-09T00:00:00.000Z",
  "variant_title": "",
  "year": 1798,
  "editor": "",
  "contributors": [],
  "entry": "rcth7xro2nnp91v"
}
