{
  "annotation": "Wandergrüße. Erinnerungen aus dem Tagebuche einer Herbstreise (Sammlung INr 81147, Obj 19)",
  "content_type": [],
  "created": "2026-06-11T10:18:21.989Z",
  "dimensions": "",
  "edit_comment": "",
  "edit_state": "Edited",
  "extent": "195",
  "incipit_statement": "Weißt du, Geliebte, was ich Geträumt die jüngste Nacht,",
  "language": [],
  "musenalm_id": 81167,
  "musenalm_pagination": [
    "Arabische Seitenzählung"
  ],
  "musenalm_type": [
    "Gedicht/Lied"
  ],
  "numbering": 39,
  "parallel_title": "",
  "place_statement": "",
  "preferred_title": "Der Traum",
  "pseudonym": false,
  "publication_statement": "",
  "responsibility_statement": "Heinrich Stieglitz",
  "scans": [],
  "subtitle_statement": "",
  "title_statement": "Der Traum",
  "updated": "2008-07-31T00:00:00.000Z",
  "variant_title": "",
  "year": 1837,
  "editor": "",
  "contributors": [
    {
      "id": "4bdlkchuj1abkvn",
      "agents": "1obisuoppirekjz",
      "annotation": "",
      "conjecture": false,
      "created": "2026-06-11T10:19:00.838Z",
      "edit_comment": "",
      "type": "Autor:in",
      "uncertain": false,
      "updated": "2026-06-11T10:19:00.838Z"
    }
  ],
  "entry": "bi5go8hqv4g3rf5"
}
