{
  "annotation": "",
  "content_type": [],
  "created": "2026-06-11T10:17:51.557Z",
  "dimensions": "",
  "edit_comment": "",
  "edit_state": "Edited",
  "extent": "287",
  "incipit_statement": "Es ist gescheh'n: die Anker sind gelichtet; / Ich stosse frey von Ihres Eylands Strand:",
  "language": [],
  "musenalm_id": 21991,
  "musenalm_pagination": [
    "Arabische Seitenzählung"
  ],
  "musenalm_type": [
    "Gedicht/Lied"
  ],
  "numbering": 155,
  "parallel_title": "",
  "place_statement": "",
  "preferred_title": "An die Musen. / Sonnett",
  "pseudonym": false,
  "publication_statement": "",
  "responsibility_statement": "Siegmar",
  "scans": [],
  "subtitle_statement": "",
  "title_statement": "An die Musen. / Sonnett",
  "updated": "2002-02-11T00:00:00.000Z",
  "variant_title": "",
  "year": 1800,
  "editor": "",
  "contributors": [],
  "entry": "y398dlaujaue6el"
}
