{
  "annotation": "V. Anekdoten und Karakterzüge aus der Theaterwelt (Sammlung INr 115575, Obj 14)",
  "content_type": [],
  "created": "2026-06-11T10:18:43.521Z",
  "dimensions": "",
  "edit_comment": "",
  "edit_state": "Edited",
  "extent": "203",
  "incipit_statement": "Während Schus Aufenthalt in Breslau meldete sich zur Aufnahme in seine Gesellschaft ein junges, munteres Weibchen,",
  "language": [],
  "musenalm_id": 115584,
  "musenalm_pagination": [
    "Arabische Seitenzählung"
  ],
  "musenalm_type": [
    "Prosa"
  ],
  "numbering": 23,
  "parallel_title": "",
  "place_statement": "",
  "preferred_title": "Während Schus Aufenthalt in Breslau meldete sich zur Aufnahme in seine Gesellschaft ein junges, munteres Weibchen,…",
  "pseudonym": false,
  "publication_statement": "",
  "responsibility_statement": "unbezeichnet",
  "scans": [],
  "subtitle_statement": "",
  "title_statement": "",
  "updated": "2010-01-07T00:00:00.000Z",
  "variant_title": "",
  "year": 1808,
  "editor": "",
  "contributors": [],
  "entry": "cudt9uyg4rvlc10"
}
