{
  "annotation": "# s. Re 39",
  "content_type": [],
  "created": "2026-06-11T10:17:43.307Z",
  "dimensions": "",
  "edit_comment": "",
  "edit_state": "Edited",
  "extent": "90",
  "incipit_statement": "Dich auch so grausam abzubrechen! / Nicht wahr, mein Blümchen, könntst du sprechen,",
  "language": [],
  "musenalm_id": 5246,
  "musenalm_pagination": [
    "Arabische Seitenzählung"
  ],
  "musenalm_type": [
    "Gedicht/Lied"
  ],
  "numbering": 59,
  "parallel_title": "",
  "place_statement": "",
  "preferred_title": "Der Knabe an ein Vergißmein- / nichtblümchen",
  "pseudonym": true,
  "publication_statement": "",
  "responsibility_statement": "Z.",
  "scans": [],
  "subtitle_statement": "",
  "title_statement": "Der Knabe an ein Vergißmein- / nichtblümchen",
  "updated": "2000-10-17T00:00:00.000Z",
  "variant_title": "",
  "year": 1776,
  "editor": "",
  "contributors": [
    {
      "id": "o0bycy6hicccryd",
      "agents": "qh3g3sytdf754hd",
      "annotation": "",
      "conjecture": false,
      "created": "2026-06-11T10:18:57.070Z",
      "edit_comment": "",
      "type": "Autor:in",
      "uncertain": false,
      "updated": "2026-06-11T10:18:57.070Z"
    }
  ],
  "entry": "bxsg9p18jlqw6e0"
}
