{
  "annotation": "IV. Kleine Abhandlungen und Aufsätze (Sammlung INr 15453, Obj 43) # Bezeichnung aus dem I-Verz; der Beitrag wird fortgesetzt in: Gartenkalender (Hirschfeld) 1784 INr 15548",
  "content_type": [],
  "created": "2026-06-11T10:17:48.994Z",
  "dimensions": "",
  "edit_comment": "",
  "edit_state": "Edited",
  "extent": "180",
  "incipit_statement": "Den Blumengarten muß man nothwendig aus einem andern Gesichtspuncte betrachten, als jene großen Anlagen,",
  "language": [],
  "musenalm_id": 15458,
  "musenalm_pagination": [
    "Arabische Seitenzählung"
  ],
  "musenalm_type": [
    "Text"
  ],
  "numbering": 49,
  "parallel_title": "",
  "place_statement": "",
  "preferred_title": "Etwas über die Ausschmückung der Blumengärten",
  "pseudonym": true,
  "publication_statement": "",
  "responsibility_statement": "Prof. Weber in Kiel",
  "scans": [],
  "subtitle_statement": "",
  "title_statement": "Etwas über die Ausschmückung der Blumengärten",
  "updated": "2001-05-18T00:00:00.000Z",
  "variant_title": "",
  "year": 1783,
  "editor": "",
  "contributors": [],
  "entry": "uz0plg0m9qs6qe8"
}
