{
  "annotation": "Silhouette nummeriert XXXXIV; »Gesang und kunstvolles Spiel«",
  "content_type": [],
  "created": "2026-06-11T10:18:53.721Z",
  "dimensions": "",
  "edit_comment": "",
  "edit_state": "Edited",
  "extent": "",
  "incipit_statement": "",
  "language": [],
  "musenalm_id": 133865,
  "musenalm_pagination": [],
  "musenalm_type": [
    "Graphik"
  ],
  "numbering": 56,
  "parallel_title": "",
  "place_statement": "",
  "preferred_title": "Anna Storace",
  "pseudonym": false,
  "publication_statement": "",
  "responsibility_statement": "unbezeichnet",
  "scans": [
    "alm_4863_133865_zxiw9pku7d.jpg"
  ],
  "subtitle_statement": "",
  "title_statement": "Anna Storace",
  "updated": "2023-12-06T00:00:00.000Z",
  "variant_title": "",
  "year": 1786,
  "editor": "",
  "contributors": [],
  "entry": "7xwxvdct5jkx6nu"
}
