{
  "annotation": "",
  "content_type": [],
  "created": "2026-06-11T10:17:52.945Z",
  "dimensions": "",
  "edit_comment": "",
  "edit_state": "Edited",
  "extent": "139",
  "incipit_statement": "Durchs Leben macht ich einen Gang, / Er schien mir kurz und währte lang.",
  "language": [],
  "musenalm_id": 24511,
  "musenalm_pagination": [
    "Arabische Seitenzählung"
  ],
  "musenalm_type": [
    "Gedicht/Lied"
  ],
  "numbering": 89,
  "parallel_title": "",
  "place_statement": "",
  "preferred_title": "Lebensfragmente",
  "pseudonym": false,
  "publication_statement": "",
  "responsibility_statement": "Ulrich Hegner",
  "scans": [],
  "subtitle_statement": "",
  "title_statement": "Lebensfragmente",
  "updated": "2002-06-05T00:00:00.000Z",
  "variant_title": "",
  "year": 1832,
  "editor": "",
  "contributors": [
    {
      "id": "wc4xmibsl4vnpvo",
      "agents": "5xr1i06rwmguu38",
      "annotation": "",
      "conjecture": false,
      "created": "2026-06-11T10:18:58.192Z",
      "edit_comment": "",
      "type": "Autor:in",
      "uncertain": false,
      "updated": "2026-06-11T10:18:58.192Z"
    }
  ],
  "entry": "9am5244vyejx2gg"
}
