{
  "annotation": "V. Bemerkungen, Anekdoten und Einfälle (Sammlung INr 11129, Obj 25) /) Prosaische Aufsätze (Sammlung INr 11121, Obj 16)",
  "content_type": [],
  "created": "2026-06-11T10:17:45.110Z",
  "dimensions": "",
  "edit_comment": "",
  "edit_state": "Edited",
  "extent": "158",
  "incipit_statement": "Diese Prinzessin des Königs von Pohlen und Churfürstens von Sachsen, August des Dritten,",
  "language": [],
  "musenalm_id": 11130,
  "musenalm_pagination": [
    "1. Arabische Seitenzählung"
  ],
  "musenalm_type": [
    "Prosa"
  ],
  "numbering": 26,
  "parallel_title": "",
  "place_statement": "",
  "preferred_title": "1. / Marie Josephe, Dauphine von Frankreich, / geborne Prinzessin von Pohlen",
  "pseudonym": false,
  "publication_statement": "",
  "responsibility_statement": "Kretschmann",
  "scans": [],
  "subtitle_statement": "",
  "title_statement": "1. / Marie Josephe, Dauphine von Frankreich, / geborne Prinzessin von Pohlen",
  "updated": "2001-02-21T00:00:00.000Z",
  "variant_title": "",
  "year": 1799,
  "editor": "",
  "contributors": [
    {
      "id": "u0hfdp8afk9ye3y",
      "agents": "r6akxiph7cy43x3",
      "annotation": "",
      "conjecture": false,
      "created": "2026-06-11T10:18:57.316Z",
      "edit_comment": "",
      "type": "Autor:in",
      "uncertain": false,
      "updated": "2026-06-11T10:18:57.316Z"
    }
  ],
  "entry": "knzr0dlijjvs2z3"
}
