{
  "annotation": "#$ lt. Re 39: vielleicht Boie",
  "content_type": [],
  "created": "2026-06-11T10:17:49.980Z",
  "dimensions": "",
  "edit_comment": "",
  "edit_state": "Edited",
  "extent": "89",
  "incipit_statement": "Auf Erden, im Olymp, ist nichts wie Sie so / schön!",
  "language": [],
  "musenalm_id": 16965,
  "musenalm_pagination": [
    "Arabische Seitenzählung"
  ],
  "musenalm_type": [
    "Gedicht/Lied"
  ],
  "numbering": 42,
  "parallel_title": "",
  "place_statement": "",
  "preferred_title": "Amanda",
  "pseudonym": false,
  "publication_statement": "",
  "responsibility_statement": "X. #$",
  "scans": [],
  "subtitle_statement": "",
  "title_statement": "Amanda",
  "updated": "2001-08-02T00:00:00.000Z",
  "variant_title": "",
  "year": 1786,
  "editor": "",
  "contributors": [],
  "entry": "m6qmlvsue6mq3y2"
}
