{
  "annotation": "",
  "content_type": [],
  "created": "2026-06-11T10:18:36.007Z",
  "dimensions": "",
  "edit_comment": "",
  "edit_state": "Edited",
  "extent": "107",
  "incipit_statement": "Wir fleh'n dich an, komm', heil'ger Geist, / Herab zu deinen Knechten,",
  "language": [],
  "musenalm_id": 101382,
  "musenalm_pagination": [
    "Arabische Seitenzählung"
  ],
  "musenalm_type": [
    "Gedicht/Lied"
  ],
  "numbering": 61,
  "parallel_title": "",
  "place_statement": "",
  "preferred_title": "Ziel des Menschen",
  "pseudonym": false,
  "publication_statement": "",
  "responsibility_statement": "Zacharias Werner",
  "scans": [],
  "subtitle_statement": "",
  "title_statement": "Ziel des Menschen",
  "updated": "2010-02-11T00:00:00.000Z",
  "variant_title": "",
  "year": 1831,
  "editor": "",
  "contributors": [
    {
      "id": "ommiweikbfwfn50",
      "agents": "g7f1xv6d8kkyhx1",
      "annotation": "",
      "conjecture": false,
      "created": "2026-06-11T10:19:02.078Z",
      "edit_comment": "",
      "type": "Autor:in",
      "uncertain": false,
      "updated": "2026-06-11T10:19:02.078Z"
    }
  ],
  "entry": "yg0ab49sckkt22e"
}
