{
  "annotation": "Figuren (Sammlung von Tanzanleitungen INr 9491, Obj 339) s. Musikbeigaben INr 9503-9512, Obj 350-359",
  "content_type": [],
  "created": "2026-06-11T10:17:44.457Z",
  "dimensions": "",
  "edit_comment": "",
  "edit_state": "Edited",
  "extent": "279",
  "incipit_statement": "",
  "language": [],
  "musenalm_id": 9498,
  "musenalm_pagination": [
    "Arabische Seitenzählung"
  ],
  "musenalm_type": [
    "Sammlung"
  ],
  "numbering": 345,
  "parallel_title": "",
  "place_statement": "",
  "preferred_title": "[Figuren zu vier und sechstourigen Anglaisen, nach sehr beliebiger Musik.] Anglaisen mit sechs Touren",
  "pseudonym": false,
  "publication_statement": "",
  "responsibility_statement": "unbezeichnet",
  "scans": [],
  "subtitle_statement": "",
  "title_statement": "[Figuren zu vier und sechstourigen Anglaisen, nach sehr beliebiger Musik.] Anglaisen mit sechs Touren",
  "updated": "2001-01-22T00:00:00.000Z",
  "variant_title": "",
  "year": 1791,
  "editor": "",
  "contributors": [],
  "entry": "bb6scl8yhe0ekb9"
}
