{
  "annotation": "",
  "content_type": [],
  "created": "2026-06-11T10:17:45.089Z",
  "dimensions": "",
  "edit_comment": "",
  "edit_state": "Edited",
  "extent": "148",
  "incipit_statement": "Ehe noch Welschland, Paris oder London das Urbild für modische Damen und Herren in Deutschland ward, genoß diese Ehre Burgund.",
  "language": [],
  "musenalm_id": 7013,
  "musenalm_pagination": [
    "Arabische Seitenzählung"
  ],
  "musenalm_type": [
    "Text"
  ],
  "numbering": 32,
  "parallel_title": "",
  "place_statement": "",
  "preferred_title": "Pluderhosen und Teufeleyen, / ein / Paar Modesachen / des sechszehnten Jahrhunderts",
  "pseudonym": false,
  "publication_statement": "",
  "responsibility_statement": "unbezeichnet",
  "scans": [],
  "subtitle_statement": "",
  "title_statement": "Pluderhosen und Teufeleyen, / ein / Paar Modesachen / des sechszehnten Jahrhunderts",
  "updated": "2000-11-23T00:00:00.000Z",
  "variant_title": "",
  "year": 1789,
  "editor": "",
  "contributors": [],
  "entry": "gmzhgcvdg5d4w7t"
}
