{
  "annotation": "Nachtitel",
  "content_type": [],
  "created": "2026-06-11T10:18:28.799Z",
  "dimensions": "",
  "edit_comment": "",
  "edit_state": "Edited",
  "extent": "",
  "incipit_statement": "",
  "language": [],
  "musenalm_id": 96408,
  "musenalm_pagination": [],
  "musenalm_type": [
    "Titel"
  ],
  "numbering": 4,
  "parallel_title": "",
  "place_statement": "",
  "preferred_title": "Rastatter / Taschenbuch / auf / 1802",
  "pseudonym": false,
  "publication_statement": "",
  "responsibility_statement": "unbezeichnet",
  "scans": [],
  "subtitle_statement": "",
  "title_statement": "Rastatter / Taschenbuch / auf / 1802",
  "updated": "2014-05-07T00:00:00.000Z",
  "variant_title": "",
  "year": 1802,
  "editor": "",
  "contributors": [],
  "entry": "g0plntt2k4mvdhy"
}
