{
  "annotation": "",
  "content_type": [],
  "created": "2026-06-11T10:18:27.197Z",
  "dimensions": "",
  "edit_comment": "",
  "edit_state": "Edited",
  "extent": "111",
  "incipit_statement": "Gesegnet seyen die Thränen! Sie sind der Lethestrom, in dem das belastete Herz seine Bürden wirft, das Taufwasser, womit der Sterbliche seine Schmerzen und Wonnen tauft,",
  "language": [],
  "musenalm_id": 87420,
  "musenalm_pagination": [
    "Arabische Seitenzählung"
  ],
  "musenalm_type": [
    "Prosa"
  ],
  "numbering": 51,
  "parallel_title": "",
  "place_statement": "",
  "preferred_title": "1. / Ueber die Thränen. / Phantasie",
  "pseudonym": false,
  "publication_statement": "",
  "responsibility_statement": "unbezeichnet",
  "scans": [],
  "subtitle_statement": "",
  "title_statement": "1. / Ueber die Thränen. / Phantasie",
  "updated": "2009-07-23T00:00:00.000Z",
  "variant_title": "",
  "year": 1822,
  "editor": "",
  "contributors": [],
  "entry": "nmxrnzhm1luljk3"
}
