{
  "annotation": "",
  "content_type": [],
  "created": "2026-06-11T10:18:15.803Z",
  "dimensions": "",
  "edit_comment": "",
  "edit_state": "Edited",
  "extent": "3",
  "incipit_statement": "",
  "language": [],
  "musenalm_id": 77634,
  "musenalm_pagination": [
    "Römische Seitenzählung"
  ],
  "musenalm_type": [
    "Inhaltsverzeichnis",
    "Graphik-Verzeichnis"
  ],
  "numbering": 4,
  "parallel_title": "",
  "place_statement": "",
  "preferred_title": "[Inhaltsverzeichnis, Graphik-Verzeichnis]",
  "pseudonym": false,
  "publication_statement": "",
  "responsibility_statement": "unbezeichnet",
  "scans": [],
  "subtitle_statement": "",
  "title_statement": "",
  "updated": "2010-02-02T00:00:00.000Z",
  "variant_title": "",
  "year": 1838,
  "editor": "",
  "contributors": [],
  "entry": "90ka8lv1gxz90mj"
}
