{
  "annotation": "Graphik im Kalendarium Juni; paginiert 6. /) Illustration zu »Liebe und kindliche Pflicht« INr 61516, Obj 33",
  "content_type": [],
  "created": "2026-06-11T10:18:10.646Z",
  "dimensions": "",
  "edit_comment": "",
  "edit_state": "Edited",
  "extent": "",
  "incipit_statement": "",
  "language": [],
  "musenalm_id": 61501,
  "musenalm_pagination": [],
  "musenalm_type": [
    "Graphik"
  ],
  "numbering": 18,
  "parallel_title": "",
  "place_statement": "",
  "preferred_title": "O! meine Tochter!",
  "pseudonym": false,
  "publication_statement": "",
  "responsibility_statement": "unbezeichnet",
  "scans": [
    "alm_981_61501_esx34um1sq.jpg"
  ],
  "subtitle_statement": "",
  "title_statement": "O! meine Tochter!",
  "updated": "2009-01-15T00:00:00.000Z",
  "variant_title": "",
  "year": 1817,
  "editor": "",
  "contributors": [],
  "entry": "eao2h9iqgsabmlt"
}
