{
  "annotation": "Umschlaggraphik r.",
  "content_type": [],
  "created": "2026-06-11T10:18:46.639Z",
  "dimensions": "",
  "edit_comment": "",
  "edit_state": "Edited",
  "extent": "",
  "incipit_statement": "",
  "language": [],
  "musenalm_id": 119601,
  "musenalm_pagination": [],
  "musenalm_type": [
    "Graphik"
  ],
  "numbering": 0.1,
  "parallel_title": "",
  "place_statement": "",
  "preferred_title": "RHEINISCHES / TASCHENBUCH. / 1844",
  "pseudonym": false,
  "publication_statement": "",
  "responsibility_statement": "unbezeichnet",
  "scans": [
    "alm_599_119601_nnfevpp10z.jpg"
  ],
  "subtitle_statement": "",
  "title_statement": "RHEINISCHES / TASCHENBUCH. / 1844",
  "updated": "2006-06-27T00:00:00.000Z",
  "variant_title": "",
  "year": 1844,
  "editor": "",
  "contributors": [],
  "entry": "y3e8c3pdmkctt6x"
}
