{
  "annotation": "# Bez. am 1. Blatt der Suite /) Graphik im Kalendarium Dezember paginiert 12.; Illustration zu »Sophiens Reise von Memel nach Sachsen« von Joh. Tim. Hermes /) mit Erläuterungen im G-Verz INr 58392, Obj 18",
  "content_type": [],
  "created": "2026-06-11T10:17:42.087Z",
  "dimensions": "",
  "edit_comment": "",
  "edit_state": "Edited",
  "extent": "",
  "incipit_statement": "",
  "language": [],
  "musenalm_id": 58391,
  "musenalm_pagination": [],
  "musenalm_type": [
    "Graphik"
  ],
  "numbering": 17,
  "parallel_title": "",
  "place_statement": "",
  "preferred_title": "[Graphik (D. Chodowiecki inv. et del. D. Berger sc. Berolini)]",
  "pseudonym": true,
  "publication_statement": "",
  "responsibility_statement": "D. Chodowiecki inv. et del. D. Berger sc. Berolini",
  "scans": [
    "alm_789_58391_v0bgyaq08m.jpg"
  ],
  "subtitle_statement": "",
  "title_statement": "",
  "updated": "2008-06-23T00:00:00.000Z",
  "variant_title": "",
  "year": 1778,
  "editor": "",
  "contributors": [
    {
      "id": "3bjlnffkknx5hiq",
      "agents": "frgalfp04iv5xmo",
      "annotation": "",
      "conjecture": false,
      "created": "2026-06-11T10:18:56.901Z",
      "edit_comment": "",
      "type": "Autor:in",
      "uncertain": false,
      "updated": "2026-06-11T10:18:56.901Z"
    },
    {
      "id": "dd4ifo2ulon4b8o",
      "agents": "qtx54xtziq79pnc",
      "annotation": "",
      "conjecture": false,
      "created": "2026-06-11T10:18:56.901Z",
      "edit_comment": "",
      "type": "Autor:in",
      "uncertain": false,
      "updated": "2026-06-11T10:18:56.901Z"
    }
  ],
  "entry": "swq6xbop7jt3zd0"
}
